Task_ID,Task_Name,Status,Priority,Assignee,Due_Date,Start_Date,Created_Date,Time_Estimate_Hours,Tags,List_Name,Folder,Space,Description,Policy_Number,Claim_Number,Customer_Name,Insurance_Type,Claim_Amount,Premium_Amount,Policy_Status,Region,Agent_Name,Department
TASK-100638,Generate quote for Patricia Kumar,In Progress,Normal,Robert Santos,2025-11-28,2025-10-31,2025-10-30,16,"high-value, payment-due, commercial",Decline Notifications,Declined Applications,Underwriting,Generate quote for Patricia Kumar - Customer Service department handling Life insurance in South region,POL-970399,,Patricia Kumar,Life,,6897.96,Expired,South,Carlos Williams,Customer Service
TASK-100639,Process address change for Thomas Garcia,In Progress,High,Robert Nakamura,2026-07-18,2026-06-22,2026-06-22,24,"commercial, VIP-customer, escalated",Application Review,Policy Issuance,Policy Operations,Process address change for Thomas Garcia - Actuarial department handling Travel insurance in Southwest region,POL-259143,,Thomas Garcia,Travel,,8183.97,Under Review,Southwest,Lisa Brown,Actuarial
TASK-100640,Update premium calculation for John Johnson,Under Review,Normal,Anthony Smith,2026-07-21,2026-06-22,2026-06-19,4,"fraud-alert, urgent-claim, high-value",Lapse Prevention,Renewals,Policy Operations,Update premium calculation for John Johnson - Fraud Investigation department handling Marine insurance in West region,POL-520345,,John Johnson,Marine,,4964.43,Expired,West,Lisa Brown,Fraud Investigation
TASK-100641,Review compliance for Marine policies,Under Review,Urgent,Margaret Jones,2026-02-27,2026-02-06,2026-02-05,2,payment-due,State Filings,Regulatory Filings,Compliance & Audit,Review compliance for Marine policies - Policy Administration department handling Marine insurance in East region,POL-962392,CLM-31004,Carlos Thomas,Marine,20950.46,8952.96,Pending,East,Michael Kumar,Policy Administration
TASK-100642,Complete internal audit for Fraud Investigation,Completed,High,John Ibrahim,2026-07-07,2026-06-20,2026-06-18,16,"renewal-due, auto-assigned",Process Audit,Internal Audit,Compliance & Audit,Complete internal audit for Fraud Investigation - Fraud Investigation department handling Liability insurance in East region,POL-443376,CLM-11411,Patricia Williams,Liability,5130.61,9502.48,Under Review,East,Lisa Brown,Fraud Investigation
TASK-100643,Resolve complaint from Sofia Jackson,In Progress,Normal,James Brown,2026-05-15,2026-04-26,2026-04-23,40,"documentation-pending, fraud-alert",Service Complaints,Complaints,Customer Support,Resolve complaint from Sofia Jackson - Claims Processing department handling Travel insurance in Central region,POL-978683,,Sofia Jackson,Travel,,10704.46,Lapsed,Central,Lisa Brown,Claims Processing
TASK-100644,Run credit check for Charles Williams,Open,High,Jessica Rodriguez,2025-11-02,2025-10-12,2025-10-10,10,"escalated, high-value",Bulk Quotes,Quote Generation,Underwriting,Run credit check for Charles Williams - New Business department handling Liability insurance in Southeast region,POL-769054,,Charles Williams,Liability,,6410.75,Expired,Southeast,Susan Singh,New Business
TASK-100645,Send policy summary to Thomas Garcia,Open,Normal,Jessica Rodriguez,2026-02-10,2026-01-24,2026-01-20,24,regulatory,Billing Complaints,Complaints,Customer Support,Send policy summary to Thomas Garcia - Underwriting department handling Marine insurance in Central region,POL-966397,,Thomas Garcia,Marine,,10079.84,Active,Central,Susan Singh,Underwriting
TASK-100646,Process claim for Priya Miller - Travel policy,On Hold,Normal,Jessica Kumar,2026-01-22,2025-12-27,2025-12-22,24,"urgent-claim, SLA-breach, documentation-pending",FNOL Processing,New Claims,Claims Management,Process claim for Priya Miller - Travel policy - Actuarial department handling Travel insurance in Midwest region,POL-954886,CLM-61608,Priya Miller,Travel,110341.15,7019.0,Active,Midwest,Robert Smith,Actuarial
TASK-100647,Review training materials for Fraud Investigation,Completed,Normal,Nancy Ibrahim,2025-10-16,2025-09-19,2025-09-17,10,fraud-alert,Process Audit,Internal Audit,Compliance & Audit,Review training materials for Fraud Investigation - Fraud Investigation department handling Travel insurance in South region,POL-940848,CLM-13719,Wei Davis,Travel,34150.58,5415.2,Under Review,South,Joseph Moore,Fraud Investigation
TASK-100648,Generate policy documents for #POL-955081,Blocked,High,Ahmed Davis,2025-04-16,2025-04-04,2025-04-02,40,escalated,Lapse Prevention,Renewals,Policy Operations,Generate policy documents for #POL-955081 - Renewals department handling Travel insurance in Southeast region,POL-955081,,Thomas Garcia,Travel,,11149.92,Active,Southeast,Joseph Thomas,Renewals
TASK-100649,Evaluate loss history for policy #POL-609021,In Progress,Normal,Ahmed Davis,2026-04-21,2026-03-27,2026-03-25,16,high-value,Decline Notifications,Declined Applications,Underwriting,Evaluate loss history for policy #POL-609021 - Fraud Investigation department handling Marine insurance in West region,POL-609021,,Karen Lee,Marine,,2694.44,Under Review,West,Sarah Jones,Fraud Investigation
TASK-100650,Process conditional approval for William Jackson,Completed,High,Lisa Kim,2025-10-21,2025-09-28,2025-09-27,4,legal-review,Custom Quotes,Quote Generation,Underwriting,Process conditional approval for William Jackson - Underwriting department handling Home insurance in West region,POL-846235,,William Jackson,Home,,5436.23,Lapsed,West,Susan Singh,Underwriting
TASK-100651,Verify coverage for claim #CLM-97493,In Progress,Normal,Jessica Rodriguez,2025-02-07,2025-01-30,2025-01-27,3,legal-review,Payment Processing,Settled Claims,Claims Management,Verify coverage for claim #CLM-97493 - Customer Service department handling Liability insurance in North region,POL-262541,CLM-97493,Margaret Chen,Liability,208395.37,14752.28,Expired,North,Linda Smith,Customer Service
TASK-100652,Conduct property inspection for Priya Jones,Under Review,Normal,Robert Ibrahim,2026-03-28,2026-02-28,2026-02-27,4,"legal-review, SLA-breach, manual-review",Standard Quotes,Quote Generation,Underwriting,Conduct property inspection for Priya Jones - New Business department handling Liability insurance in Northwest region,POL-678002,,Priya Jones,Liability,,6114.33,Pending,Northwest,Carlos Anderson,New Business
TASK-100653,Calculate premium for Travel policy,Open,Low,William Kim,2025-06-11,2025-05-12,2025-05-12,3,"commercial, escalated",Custom Quotes,Quote Generation,Underwriting,Calculate premium for Travel policy - Policy Administration department handling Travel insurance in South region,POL-967641,,Carlos Singh,Travel,,7710.32,Under Review,South,Carlos Anderson,Policy Administration
TASK-100654,Review training materials for Claims Processing,Blocked,Normal,James Brown,2026-03-29,2026-03-23,2026-03-23,24,"urgent-claim, escalated, new-customer",Financial Audit,Internal Audit,Compliance & Audit,Review training materials for Claims Processing - Claims Processing department handling Commercial insurance in Midwest region,POL-748865,CLM-67392,Patricia Kumar,Commercial,1105.76,6837.33,Cancelled,Midwest,Joseph Jones,Claims Processing
TASK-100655,Decline application - notify Patricia Davis,In Progress,Normal,Anthony Smith,2025-12-11,2025-11-18,2025-11-14,20,"documentation-pending, commercial, SLA-breach",Pending Approval,Approval Queue,Underwriting,Decline application - notify Patricia Davis - Policy Administration department handling Liability insurance in Southeast region,POL-325657,,Patricia Davis,Liability,,5091.89,Cancelled,Southeast,Linda Smith,Policy Administration
TASK-100656,Complete internal audit for Underwriting,Blocked,High,Barbara Ibrahim,2026-03-11,2026-03-05,2026-02-28,10,"documentation-pending, legal-review, VIP-customer",Annual Reports,Regulatory Filings,Compliance & Audit,Complete internal audit for Underwriting - Underwriting department handling Travel insurance in Midwest region,POL-174462,CLM-90458,David Patel,Travel,36627.82,3882.23,Under Review,Midwest,Michael Kumar,Underwriting
TASK-100657,Review application from Lisa Williams,Completed,Urgent,Margaret Jones,2025-12-23,2025-12-19,2025-12-18,8,"legal-review, fraud-alert",Property Inspection,Risk Assessment,Underwriting,Review application from Lisa Williams - New Business department handling Marine insurance in Midwest region,POL-499812,,Lisa Williams,Marine,,2825.68,Expired,Midwest,Jennifer Miller,New Business
TASK-100658,Assess risk for Michael Santos - Liability,Completed,High,Jessica Rodriguez,2025-03-19,2025-03-07,2025-03-02,20,"urgent-claim, legal-review, escalated",Credit Check,Risk Assessment,Underwriting,Assess risk for Michael Santos - Liability - Risk Assessment department handling Liability insurance in South region,POL-121391,,Michael Santos,Liability,,225.59,Lapsed,South,Carlos Anderson,Risk Assessment
TASK-100659,Investigate damage report for James Kumar,In Progress,Low,Michael Lopez,2026-01-29,2026-01-23,2026-01-19,0.5,commercial,Adjuster Review,Pending Claims,Claims Management,Investigate damage report for James Kumar - Risk Assessment department handling Liability insurance in East region,POL-462018,CLM-22709,James Kumar,Liability,222913.47,10654.24,Lapsed,East,Sarah Davis,Risk Assessment
TASK-100660,Verify fraud indicators for claim #CLM-87346,On Hold,Normal,Daniel Miller,2025-07-07,2025-06-21,2025-06-21,10,"legal-review, escalated, new-customer",Federal Filings,Regulatory Filings,Compliance & Audit,Verify fraud indicators for claim #CLM-87346 - Renewals department handling Commercial insurance in South region,POL-289180,CLM-87346,Thomas Jones,Commercial,9657.98,2497.74,Active,South,Sarah Jones,Renewals
TASK-100661,Process claim for Barbara Rodriguez - Travel policy,Open,Low,James Brown,2026-02-01,2026-01-02,2026-01-02,24,"manual-review, documentation-pending, regulatory",Payment Processing,Settled Claims,Claims Management,Process claim for Barbara Rodriguez - Travel policy - Customer Service department handling Travel insurance in East region,POL-297488,CLM-62990,Barbara Rodriguez,Travel,245595.24,7310.27,Under Review,East,Aisha Miller,Customer Service
TASK-100662,Update documentation for regulatory change,Closed,Normal,Daniel Miller,2026-03-30,2026-03-16,2026-03-13,4,"high-value, escalated",Training Materials,Documentation,Compliance & Audit,Update documentation for regulatory change - Renewals department handling Health insurance in Central region,POL-569661,CLM-35957,Raj Ibrahim,Health,18853.35,7458.89,Pending,Central,Omar Smith,Renewals
TASK-100663,Investigate damage report for Lisa Miller,Under Review,Low,Margaret Jackson,2025-11-25,2025-11-23,2025-11-18,24,"SLA-breach, renewal-due",FNOL Processing,New Claims,Claims Management,Investigate damage report for Lisa Miller - Actuarial department handling Home insurance in Central region,POL-699025,CLM-81144,Lisa Miller,Home,133805.89,898.67,Pending,Central,Margaret Hernandez,Actuarial
TASK-100664,Review compliance for Travel policies,Completed,High,Barbara Ali,2025-12-17,2025-11-24,2025-11-24,1,"regulatory, urgent-claim, payment-due",Compliance Check,Internal Audit,Compliance & Audit,Review compliance for Travel policies - Customer Service department handling Travel insurance in North region,POL-579444,CLM-34340,Sandra Wilson,Travel,10180.41,3259.71,Cancelled,North,Linda Smith,Customer Service
TASK-100665,Update beneficiary for John Ibrahim,Under Review,High,Robert Santos,2025-10-06,2025-09-14,2025-09-10,24,"regulatory, manual-review, auto-assigned",Coverage Changes,Endorsements,Policy Operations,Update beneficiary for John Ibrahim - Renewals department handling Marine insurance in West region,POL-146930,,John Ibrahim,Marine,,13848.23,Under Review,West,Joseph Moore,Renewals
TASK-100666,Assist Linda Jones with claims process,On Hold,High,Barbara Ibrahim,2025-02-08,2025-01-16,2025-01-11,1,"VIP-customer, auto-assigned",Policy Inquiries,Inquiries,Customer Support,Assist Linda Jones with claims process - Fraud Investigation department handling Marine insurance in Southeast region,POL-956397,,Linda Jones,Marine,,10500.83,Active,Southeast,Sofia Anderson,Fraud Investigation
TASK-100667,Assist Thomas Jones with claims process,Blocked,Low,Nancy Martin,2025-11-20,2025-10-23,2025-10-21,1,SLA-breach,General Inquiries,Inquiries,Customer Support,Assist Thomas Jones with claims process - Fraud Investigation department handling Travel insurance in East region,POL-849756,,Thomas Jones,Travel,,1805.68,Lapsed,East,William Chen,Fraud Investigation
TASK-100668,Issue new Auto policy for Aisha Davis,Closed,Normal,Lisa Kim,2026-02-06,2026-02-03,2026-02-02,2,SLA-breach,Lapse Prevention,Renewals,Policy Operations,Issue new Auto policy for Aisha Davis - Compliance department handling Auto insurance in Northwest region,POL-216818,,Aisha Davis,Auto,,12134.85,Pending,Northwest,Lisa Brown,Compliance
TASK-100669,Verify coverage for claim #CLM-54741,Under Review,Normal,Aisha Jones,2025-07-16,2025-07-01,2025-06-29,2,"SLA-breach, VIP-customer",Adjuster Review,Pending Claims,Claims Management,Verify coverage for claim #CLM-54741 - Actuarial department handling Travel insurance in North region,POL-260128,CLM-54741,Thomas Kim,Travel,50562.0,9733.2,Under Review,North,Robert Smith,Actuarial
TASK-100670,Calculate premium for Liability policy,Closed,Urgent,Lisa Kim,2025-07-03,2025-06-15,2025-06-14,2,"high-value, SLA-breach, commercial",Decline Notifications,Declined Applications,Underwriting,Calculate premium for Liability policy - Customer Service department handling Liability insurance in South region,POL-654231,,Omar Williams,Liability,,1039.35,Under Review,South,Aisha Miller,Customer Service
TASK-100671,Assess risk for Sofia Jackson - Home,Closed,Urgent,Barbara Ibrahim,2026-02-09,2026-02-05,2026-02-01,10,regulatory,Property Inspection,Risk Assessment,Underwriting,Assess risk for Sofia Jackson - Home - Claims Processing department handling Home insurance in West region,POL-103587,,Sofia Jackson,Home,,11480.21,Lapsed,West,Joseph Thomas,Claims Processing
TASK-100672,Decline application - notify Barbara Moore,On Hold,Normal,Daniel Miller,2026-05-22,2026-05-07,2026-05-06,4,fraud-alert,Appeal Processing,Declined Applications,Underwriting,Decline application - notify Barbara Moore - Actuarial department handling Health insurance in Northwest region,POL-461912,,Barbara Moore,Health,,5530.0,Expired,Northwest,Carlos Anderson,Actuarial
TASK-100673,Schedule adjuster visit for claim #CLM-80975,Completed,Normal,Michael Lopez,2026-03-16,2026-02-17,2026-02-16,8,"SLA-breach, legal-review",Re-assessment,Disputed Claims,Claims Management,Schedule adjuster visit for claim #CLM-80975 - Compliance department handling Life insurance in North region,POL-845208,CLM-80975,Wei Davis,Life,156811.73,3279.89,Pending,North,Carlos Anderson,Compliance
TASK-100674,Review bulk quote batch #POL-327498,Blocked,Normal,Robert Ibrahim,2025-08-15,2025-07-24,2025-07-19,24,"commercial, payment-due",Conditional Approval,Approval Queue,Underwriting,Review bulk quote batch #POL-327498 - Customer Service department handling Life insurance in Southwest region,POL-327498,,James Ali,Life,,5578.54,Cancelled,Southwest,Robert Smith,Customer Service
TASK-100675,Process billing inquiry from Karen Davis,In Progress,Low,Mark Jackson,2025-03-02,2025-02-23,2025-02-22,40,"SLA-breach, commercial, legal-review",Claims Complaints,Complaints,Customer Support,Process billing inquiry from Karen Davis - Compliance department handling Home insurance in Southwest region,POL-973346,,Karen Davis,Home,,13370.88,Expired,Southwest,Joseph Thomas,Compliance
TASK-100676,Conduct process audit for Actuarial,Blocked,Normal,Lisa Kim,2026-05-24,2026-04-26,2026-04-25,24,"escalated, regulatory",Financial Audit,Internal Audit,Compliance & Audit,Conduct process audit for Actuarial - Actuarial department handling Life insurance in Southeast region,POL-258002,CLM-63908,Margaret Lee,Life,36923.28,11486.78,Active,Southeast,Michael Kumar,Actuarial
TASK-100677,Schedule adjuster visit for claim #CLM-56752,Completed,Normal,Barbara Ali,2025-06-15,2025-06-05,2025-06-04,2,"regulatory, payment-due",FNOL Processing,New Claims,Claims Management,Schedule adjuster visit for claim #CLM-56752 - Renewals department handling Auto insurance in North region,POL-428512,CLM-56752,William Jackson,Auto,210249.29,5571.51,Cancelled,North,Omar Smith,Renewals
TASK-100678,Investigate damage report for Patricia Garcia,In Progress,Low,John Ibrahim,2026-05-10,2026-05-01,2026-04-26,0.5,auto-assigned,Adjuster Review,Pending Claims,Claims Management,Investigate damage report for Patricia Garcia - Underwriting department handling Life insurance in Southeast region,POL-748322,CLM-63697,Patricia Garcia,Life,172645.95,13574.04,Expired,Southeast,Joseph Thomas,Underwriting
TASK-100679,Schedule callback for John Ibrahim,Open,Low,James Brown,2025-08-07,2025-07-09,2025-07-06,2,"regulatory, escalated, payment-due",Reviews,Feedback,Customer Support,Schedule callback for John Ibrahim - Actuarial department handling Life insurance in North region,POL-957684,,John Ibrahim,Life,,7478.15,Expired,North,Lisa Brown,Actuarial
TASK-100680,Evaluate loss history for policy #POL-845965,Blocked,High,Anthony Lee,2026-06-11,2026-05-22,2026-05-22,4,escalated,Decline Notifications,Declined Applications,Underwriting,Evaluate loss history for policy #POL-845965 - Renewals department handling Home insurance in West region,POL-845965,,Mary Brown,Home,,6382.53,Lapsed,West,Linda Smith,Renewals
TASK-100681,Update Wei Lee on policy status,Open,High,Ahmed Davis,2025-03-09,2025-02-13,2025-02-11,20,"high-value, escalated, commercial",Manager Escalation,Escalations,Customer Support,Update Wei Lee on policy status - Fraud Investigation department handling Auto insurance in West region,POL-570738,,Wei Lee,Auto,,9919.06,Active,West,Susan Singh,Fraud Investigation
TASK-100682,Verify coverage for claim #CLM-98067,Under Review,High,Robert Ibrahim,2026-02-03,2026-01-22,2026-01-20,40,"SLA-breach, manual-review",Closure Documentation,Settled Claims,Claims Management,Verify coverage for claim #CLM-98067 - New Business department handling Health insurance in Northwest region,POL-137731,CLM-98067,Joseph Smith,Health,200884.93,12833.67,Cancelled,Northwest,Sarah Jones,New Business
TASK-100683,Send renewal notice for policy #POL-188914,Open,High,James Brown,2026-06-07,2026-06-06,2026-06-06,2,renewal-due,Non-Payment Cancellation,Cancellations,Policy Operations,Send renewal notice for policy #POL-188914 - Compliance department handling Commercial insurance in South region,POL-188914,,Raj Brown,Commercial,,12132.15,Lapsed,South,Jennifer Miller,Compliance
TASK-100684,Request additional documents for claim #CLM-86382,On Hold,Low,Robert Nakamura,2025-12-14,2025-12-10,2025-12-05,1,renewal-due,FNOL Processing,New Claims,Claims Management,Request additional documents for claim #CLM-86382 - Actuarial department handling Auto insurance in Northeast region,POL-263833,CLM-86382,Nancy Garcia,Auto,153335.01,1031.26,Under Review,Northeast,Joseph Jones,Actuarial
TASK-100685,Process payment for settled claim #CLM-60711,Under Review,Normal,Jessica Santos,2025-08-16,2025-07-20,2025-07-17,0.5,"manual-review, VIP-customer, new-customer",Arbitration,Disputed Claims,Claims Management,Process payment for settled claim #CLM-60711 - Claims Processing department handling Health insurance in West region,POL-183269,CLM-60711,Aisha Martinez,Health,49726.29,14821.36,Pending,West,Sofia Anderson,Claims Processing
TASK-100686,Review compliance for Life policies,In Progress,Normal,William Kim,2025-06-06,2025-05-12,2025-05-07,20,"documentation-pending, renewal-due",State Filings,Regulatory Filings,Compliance & Audit,Review compliance for Life policies - Fraud Investigation department handling Life insurance in West region,POL-668326,CLM-85423,Priya Wilson,Life,3788.99,2968.31,Cancelled,West,Lisa Brown,Fraud Investigation
TASK-100687,Respond to inquiry from Aisha Jones,Open,Normal,William Kim,2025-10-12,2025-09-17,2025-09-15,8,"escalated, manual-review",Manager Escalation,Escalations,Customer Support,Respond to inquiry from Aisha Jones - Renewals department handling Marine insurance in Central region,POL-352466,,Aisha Jones,Marine,,1111.97,Active,Central,James Singh,Renewals
TASK-100688,Request additional documents for claim #CLM-51820,On Hold,High,Jessica Santos,2026-02-02,2026-01-07,2026-01-02,2,"escalated, commercial",Document Collection,New Claims,Claims Management,Request additional documents for claim #CLM-51820 - Underwriting department handling Travel insurance in Midwest region,POL-375185,CLM-51820,Sofia Ali,Travel,120371.98,7595.48,Active,Midwest,Carlos Anderson,Underwriting
TASK-100689,Escalate issue for Michael Johnson to manager,In Progress,Normal,Mark Jackson,2026-02-03,2026-02-02,2026-01-30,8,"payment-due, auto-assigned",Reviews,Feedback,Customer Support,Escalate issue for Michael Johnson to manager - Compliance department handling Travel insurance in Southeast region,POL-574141,,Michael Johnson,Travel,,11866.33,Under Review,Southeast,Sofia Anderson,Compliance
TASK-100690,Send renewal notice for policy #POL-257181,Completed,Normal,Aisha Ibrahim,2025-08-07,2025-07-22,2025-07-22,8,"fraud-alert, renewal-due, payment-due",Auto-Renewal,Renewals,Policy Operations,Send renewal notice for policy #POL-257181 - New Business department handling Home insurance in North region,POL-257181,,Lisa Kim,Home,,4692.13,Pending,North,Sofia Anderson,New Business
TASK-100691,Assist Carlos Chen with claims process,Under Review,Normal,Nancy Ibrahim,2025-06-12,2025-05-26,2025-05-25,24,"new-customer, urgent-claim",Policy Inquiries,Inquiries,Customer Support,Assist Carlos Chen with claims process - Renewals department handling Home insurance in South region,POL-599856,,Carlos Chen,Home,,12093.61,Cancelled,South,Lisa Brown,Renewals
TASK-100692,Escalate issue for Omar Anderson to manager,Under Review,Normal,Ahmed Davis,2026-02-03,2026-01-18,2026-01-14,5,"renewal-due, legal-review",Claims Inquiries,Inquiries,Customer Support,Escalate issue for Omar Anderson to manager - Fraud Investigation department handling Life insurance in Southwest region,POL-859962,,Omar Anderson,Life,,6816.76,Under Review,Southwest,William Chen,Fraud Investigation
TASK-100693,Review bulk quote batch #POL-700073,Completed,Normal,William Kim,2025-09-17,2025-09-01,2025-08-31,5,"commercial, high-value",Conditional Approval,Approval Queue,Underwriting,Review bulk quote batch #POL-700073 - Renewals department handling Health insurance in East region,POL-700073,,Sofia Martin,Health,,13380.24,Active,East,Margaret Hernandez,Renewals
TASK-100694,Escalate issue for Thomas Garcia to manager,Closed,Normal,Elizabeth Jackson,2026-01-24,2026-01-08,2026-01-08,4,"escalated, payment-due",Reviews,Feedback,Customer Support,Escalate issue for Thomas Garcia to manager - New Business department handling Home insurance in Northwest region,POL-302565,,Thomas Garcia,Home,,9569.43,Cancelled,Northwest,William Chen,New Business
TASK-100695,Conduct property inspection for Robert Kim,Under Review,High,Elizabeth Jackson,2026-07-05,2026-06-25,2026-06-21,4,"payment-due, legal-review, urgent-claim",Bulk Quotes,Quote Generation,Underwriting,Conduct property inspection for Robert Kim - Actuarial department handling Health insurance in Midwest region,POL-409979,,Robert Kim,Health,,5764.93,Active,Midwest,Linda Smith,Actuarial
TASK-100696,Escalate issue for Jennifer Anderson to manager,Closed,Normal,Robert Nakamura,2026-04-06,2026-04-02,2026-03-31,20,manual-review,Policy Inquiries,Inquiries,Customer Support,Escalate issue for Jennifer Anderson to manager - Compliance department handling Liability insurance in East region,POL-500576,,Jennifer Anderson,Liability,,6947.96,Expired,East,Aisha Miller,Compliance
TASK-100697,Follow up on pending claim #CLM-51322,Blocked,Urgent,Robert Martinez,2025-02-15,2025-02-01,2025-01-27,5,"regulatory, payment-due",FNOL Processing,New Claims,Claims Management,Follow up on pending claim #CLM-51322 - Compliance department handling Travel insurance in Southwest region,POL-248638,CLM-51322,Linda Davis,Travel,161758.92,6053.96,Lapsed,Southwest,Susan Singh,Compliance
TASK-100698,Review claim #CLM-29866 documentation,Completed,High,James Brown,2026-07-14,2026-06-21,2026-06-20,10,"escalated, high-value",Initial Assessment,New Claims,Claims Management,Review claim #CLM-29866 documentation - Underwriting department handling Life insurance in Northwest region,POL-246707,CLM-29866,Sarah Thomas,Life,59135.89,11368.96,Pending,Northwest,Sarah Jones,Underwriting
TASK-100699,Request additional documents for claim #CLM-37165,On Hold,Normal,Mark Jackson,2025-07-07,2025-06-12,2025-06-12,0.5,urgent-claim,Arbitration,Disputed Claims,Claims Management,Request additional documents for claim #CLM-37165 - Risk Assessment department handling Marine insurance in East region,POL-953922,CLM-37165,John Lee,Marine,227900.38,4059.17,Under Review,East,Jennifer Miller,Risk Assessment
TASK-100700,Update Christopher Miller on policy status,On Hold,Normal,Jessica Kumar,2026-02-28,2026-02-06,2026-02-01,16,"new-customer, urgent-claim",General Inquiries,Inquiries,Customer Support,Update Christopher Miller on policy status - Policy Administration department handling Health insurance in West region,POL-624900,,Christopher Miller,Health,,7751.65,Active,West,Sarah Davis,Policy Administration
TASK-100701,Review lapsed policy #POL-466353,Open,Low,Lisa Kim,2026-02-14,2026-01-16,2026-01-12,20,commercial,Application Review,Policy Issuance,Policy Operations,Review lapsed policy #POL-466353 - Compliance department handling Health insurance in Midwest region,POL-466353,,Michael Lopez,Health,,6078.29,Cancelled,Midwest,Joseph Moore,Compliance
