Task_ID,Task_Name,Status,Priority,Assignee,Due_Date,Start_Date,Created_Date,Time_Estimate_Hours,Tags,List_Name,Folder,Space,Description,Policy_Number,Claim_Number,Customer_Name,Insurance_Type,Claim_Amount,Premium_Amount,Policy_Status,Region,Agent_Name,Department
TASK-100191,Review compliance for Home policies,Blocked,High,John Ibrahim,2026-04-01,2026-03-04,2026-02-27,2,regulatory,Training Materials,Documentation,Compliance & Audit,Review compliance for Home policies - Customer Service department handling Home insurance in Central region,POL-877446,CLM-55069,Lisa Miller,Home,25627.63,2582.12,Under Review,Central,Susan Singh,Customer Service
TASK-100192,Close resolved claim #CLM-35875,Closed,Urgent,Nancy Martin,2026-05-28,2026-05-16,2026-05-14,5,fraud-alert,Arbitration,Disputed Claims,Claims Management,Close resolved claim #CLM-35875 - Underwriting department handling Home insurance in Central region,POL-202972,CLM-35875,Barbara Moore,Home,32489.68,9901.0,Pending,Central,James Singh,Underwriting
TASK-100193,Conduct property inspection for Sofia Wilson,On Hold,High,Aisha Ibrahim,2025-09-13,2025-08-20,2025-08-15,10,"VIP-customer, auto-assigned",Pending Approval,Approval Queue,Underwriting,Conduct property inspection for Sofia Wilson - New Business department handling Travel insurance in Northeast region,POL-105066,,Sofia Wilson,Travel,,4294.86,Pending,Northeast,Carlos Anderson,New Business
TASK-100194,Calculate premium for Life policy,Open,Low,Barbara Ibrahim,2025-08-16,2025-07-23,2025-07-21,0.5,legal-review,Decline Notifications,Declined Applications,Underwriting,Calculate premium for Life policy - Underwriting department handling Life insurance in Midwest region,POL-966589,,Fatima Shah,Life,,1331.64,Lapsed,Midwest,Susan Singh,Underwriting
TASK-100195,Update Lisa Kim on policy status,Closed,Normal,Daniel Miller,2026-03-08,2026-02-07,2026-02-06,5,"VIP-customer, new-customer",Service Complaints,Complaints,Customer Support,Update Lisa Kim on policy status - Risk Assessment department handling Commercial insurance in Southwest region,POL-785672,,Lisa Kim,Commercial,,11051.76,Lapsed,Southwest,Linda Smith,Risk Assessment
TASK-100196,Update beneficiary for David Moore,Under Review,High,Anthony Smith,2026-05-15,2026-05-13,2026-05-11,3,fraud-alert,Lapse Prevention,Renewals,Policy Operations,Update beneficiary for David Moore - Policy Administration department handling Life insurance in Northwest region,POL-693868,,David Moore,Life,,7417.1,Lapsed,Northwest,Carlos Anderson,Policy Administration
TASK-100197,Assist Sarah Shah with claims process,On Hold,Low,James Brown,2025-10-19,2025-10-01,2025-09-27,16,"escalated, regulatory",Reviews,Feedback,Customer Support,Assist Sarah Shah with claims process - Renewals department handling Auto insurance in North region,POL-837920,,Sarah Shah,Auto,,5774.56,Cancelled,North,Joseph Thomas,Renewals
TASK-100198,Update beneficiary for Omar Williams,In Progress,High,William Kim,2026-04-05,2026-03-28,2026-03-27,40,VIP-customer,Non-Payment Cancellation,Cancellations,Policy Operations,Update beneficiary for Omar Williams - Compliance department handling Travel insurance in Northwest region,POL-106918,,Omar Williams,Travel,,9723.46,Active,Northwest,Jennifer Miller,Compliance
TASK-100199,Process billing inquiry from Sandra Moore,Closed,Urgent,Jessica Santos,2025-01-26,2025-01-24,2025-01-23,2,auto-assigned,Manager Escalation,Escalations,Customer Support,Process billing inquiry from Sandra Moore - Compliance department handling Liability insurance in Northwest region,POL-719489,,Sandra Moore,Liability,,8966.75,Active,Northwest,Sofia Anderson,Compliance
TASK-100200,Run credit check for Thomas Miller,Blocked,Normal,Elizabeth Jackson,2025-04-14,2025-03-30,2025-03-29,20,"VIP-customer, renewal-due",Bulk Quotes,Quote Generation,Underwriting,Run credit check for Thomas Miller - Actuarial department handling Marine insurance in Midwest region,POL-119524,,Thomas Miller,Marine,,7176.92,Expired,Midwest,Lisa Brown,Actuarial
TASK-100201,File annual report for Northwest,Closed,Urgent,Aisha Ibrahim,2026-02-04,2026-01-31,2026-01-30,20,"auto-assigned, SLA-breach, VIP-customer",Suspected Fraud,Fraud Cases,Compliance & Audit,File annual report for Northwest - Actuarial department handling Travel insurance in Northwest region,POL-172187,CLM-40122,Patricia Moore,Travel,828.13,7936.13,Lapsed,Northwest,Sarah Davis,Actuarial
TASK-100202,File annual report for East,Completed,Normal,Daniel Miller,2026-07-04,2026-06-22,2026-06-19,5,"renewal-due, documentation-pending",State Filings,Regulatory Filings,Compliance & Audit,File annual report for East - Actuarial department handling Liability insurance in East region,POL-967719,CLM-10157,Matthew Rodriguez,Liability,43741.22,10525.11,Lapsed,East,Susan Singh,Actuarial
TASK-100203,Escalate disputed claim #CLM-88419 to legal,Closed,High,Mark Jackson,2026-03-04,2026-02-25,2026-02-23,8,regulatory,Legal Review,Disputed Claims,Claims Management,Escalate disputed claim #CLM-88419 to legal - Customer Service department handling Commercial insurance in Northwest region,POL-397026,CLM-88419,Sarah Chen,Commercial,1864.63,11205.96,Under Review,Northwest,Robert Smith,Customer Service
TASK-100204,Run credit check for David Kumar,Completed,Normal,Elizabeth Shah,2026-03-26,2026-03-14,2026-03-10,10,"documentation-pending, renewal-due",Appeal Processing,Declined Applications,Underwriting,Run credit check for David Kumar - New Business department handling Home insurance in East region,POL-713805,,David Kumar,Home,,14878.62,Expired,East,Carlos Anderson,New Business
TASK-100205,Investigate suspected fraud case #CLM-62183,In Progress,Normal,Jessica Rodriguez,2025-05-15,2025-05-07,2025-05-02,5,high-value,Compliance Records,Documentation,Compliance & Audit,Investigate suspected fraud case #CLM-62183 - Renewals department handling Commercial insurance in Midwest region,POL-839764,CLM-62183,David Patel,Commercial,22329.74,10549.81,Lapsed,Midwest,Lisa Brown,Renewals
TASK-100206,Review claim #CLM-67065 documentation,On Hold,Normal,Barbara Ali,2025-03-17,2025-03-09,2025-03-07,20,"SLA-breach, legal-review, regulatory",Third-Party Verification,Pending Claims,Claims Management,Review claim #CLM-67065 documentation - Policy Administration department handling Auto insurance in South region,POL-729402,CLM-67065,Lisa Kim,Auto,93023.36,9213.63,Active,South,Sofia Anderson,Policy Administration
TASK-100207,Send policy summary to William Kim,Open,Low,James Brown,2026-06-26,2026-06-18,2026-06-13,4,"renewal-due, auto-assigned",Surveys,Feedback,Customer Support,Send policy summary to William Kim - Fraud Investigation department handling Health insurance in Southwest region,POL-135241,,William Kim,Health,,10175.56,Pending,Southwest,Carlos Anderson,Fraud Investigation
TASK-100208,Handle coverage question from Margaret Chen,Completed,Normal,Margaret Jones,2026-01-21,2025-12-25,2025-12-23,2,new-customer,Surveys,Feedback,Customer Support,Handle coverage question from Margaret Chen - Underwriting department handling Auto insurance in South region,POL-398313,,Margaret Chen,Auto,,9174.18,Pending,South,Margaret Hernandez,Underwriting
TASK-100209,Close resolved claim #CLM-80504,Under Review,Low,Michael Lopez,2025-10-04,2025-09-19,2025-09-14,24,documentation-pending,Initial Assessment,New Claims,Claims Management,Close resolved claim #CLM-80504 - Underwriting department handling Commercial insurance in Northeast region,POL-370211,CLM-80504,James Williams,Commercial,241530.84,8534.9,Pending,Northeast,Susan Singh,Underwriting
TASK-100210,Schedule adjuster visit for claim #CLM-38885,Open,Normal,Lisa Kim,2025-12-05,2025-11-23,2025-11-20,5,"renewal-due, fraud-alert",Legal Review,Disputed Claims,Claims Management,Schedule adjuster visit for claim #CLM-38885 - New Business department handling Commercial insurance in South region,POL-926965,CLM-38885,Fatima Hernandez,Commercial,129367.8,343.9,Active,South,Sarah Jones,New Business
TASK-100211,Process endorsement for policy #POL-291663,In Progress,Low,William Kim,2026-06-07,2026-05-31,2026-05-26,20,"renewal-due, legal-review",Non-Payment Cancellation,Cancellations,Policy Operations,Process endorsement for policy #POL-291663 - Actuarial department handling Travel insurance in West region,POL-291663,,Richard Jones,Travel,,3782.44,Cancelled,West,Carlos Williams,Actuarial
TASK-100212,Process claim for Margaret Nakamura - Liability policy,In Progress,Low,Ahmed Davis,2026-05-31,2026-05-11,2026-05-09,16,"payment-due, fraud-alert, new-customer",FNOL Processing,New Claims,Claims Management,Process claim for Margaret Nakamura - Liability policy - Claims Processing department handling Liability insurance in Midwest region,POL-998723,CLM-80972,Margaret Nakamura,Liability,79196.52,13492.19,Cancelled,Midwest,Joseph Thomas,Claims Processing
TASK-100213,Update premium calculation for Aisha Martinez,In Progress,Normal,John Ibrahim,2025-07-05,2025-07-01,2025-06-28,5,"urgent-claim, legal-review, auto-assigned",Auto-Renewal,Renewals,Policy Operations,Update premium calculation for Aisha Martinez - Risk Assessment department handling Marine insurance in Northwest region,POL-626883,,Aisha Martinez,Marine,,7009.04,Cancelled,Northwest,Lisa Brown,Risk Assessment
TASK-100214,Evaluate loss history for policy #POL-742865,Completed,High,Robert Nakamura,2025-07-25,2025-07-11,2025-07-08,20,"escalated, payment-due",Bulk Quotes,Quote Generation,Underwriting,Evaluate loss history for policy #POL-742865 - Fraud Investigation department handling Commercial insurance in West region,POL-742865,,Lisa Kim,Commercial,,10570.55,Expired,West,Susan Singh,Fraud Investigation
TASK-100215,Process endorsement for policy #POL-997904,Blocked,Normal,Elizabeth Shah,2025-06-09,2025-06-04,2025-05-30,40,"new-customer, VIP-customer",Delivery,Policy Issuance,Policy Operations,Process endorsement for policy #POL-997904 - Risk Assessment department handling Commercial insurance in West region,POL-997904,,Ahmed Davis,Commercial,,344.19,Cancelled,West,William Chen,Risk Assessment
TASK-100216,Decline application - notify Joseph Santos,Under Review,Urgent,John Ibrahim,2025-05-06,2025-04-12,2025-04-09,5,"commercial, documentation-pending, fraud-alert",Pending Approval,Approval Queue,Underwriting,Decline application - notify Joseph Santos - Policy Administration department handling Marine insurance in South region,POL-325933,,Joseph Santos,Marine,,5542.24,Under Review,South,Lisa Brown,Policy Administration
TASK-100217,Process renewal for policy #POL-912378,Blocked,Low,Jessica Kumar,2026-02-09,2026-01-30,2026-01-26,24,auto-assigned,Manual Renewal,Renewals,Policy Operations,Process renewal for policy #POL-912378 - Risk Assessment department handling Travel insurance in Northeast region,POL-912378,,David Anderson,Travel,,14357.6,Lapsed,Northeast,Susan Singh,Risk Assessment
TASK-100218,Assist Priya Nakamura with claims process,Closed,Low,Jessica Kumar,2025-10-26,2025-10-05,2025-10-01,2,"manual-review, regulatory",General Inquiries,Inquiries,Customer Support,Assist Priya Nakamura with claims process - Customer Service department handling Life insurance in Northeast region,POL-432270,,Priya Nakamura,Life,,13337.84,Expired,Northeast,Linda Smith,Customer Service
TASK-100219,Process renewal for policy #POL-516332,Under Review,Normal,James Brown,2025-03-28,2025-03-10,2025-03-07,24,"documentation-pending, high-value, payment-due",Lapse Prevention,Renewals,Policy Operations,Process renewal for policy #POL-516332 - Customer Service department handling Commercial insurance in South region,POL-516332,,Sofia Anderson,Commercial,,11609.82,Pending,South,Omar Smith,Customer Service
TASK-100220,Issue new Commercial policy for Susan Shah,Closed,Low,Elizabeth Shah,2025-02-22,2025-02-10,2025-02-05,10,"new-customer, payment-due",Lapse Prevention,Renewals,Policy Operations,Issue new Commercial policy for Susan Shah - Policy Administration department handling Commercial insurance in Northwest region,POL-652329,,Susan Shah,Commercial,,5012.98,Expired,Northwest,Sarah Jones,Policy Administration
TASK-100221,Generate policy documents for #POL-338161,Blocked,Normal,Elizabeth Jackson,2025-11-28,2025-11-14,2025-11-12,5,commercial,Non-Payment Cancellation,Cancellations,Policy Operations,Generate policy documents for #POL-338161 - Compliance department handling Commercial insurance in Northeast region,POL-338161,,Matthew Rodriguez,Commercial,,4692.88,Cancelled,Northeast,William Chen,Compliance
TASK-100222,Update documentation for regulatory change,In Progress,Normal,Barbara Ibrahim,2025-09-12,2025-08-25,2025-08-25,8,"SLA-breach, legal-review, renewal-due",Annual Reports,Regulatory Filings,Compliance & Audit,Update documentation for regulatory change - Fraud Investigation department handling Liability insurance in Northwest region,POL-903072,CLM-66418,Daniel Lee,Liability,18682.19,6293.69,Pending,Northwest,Jennifer Miller,Fraud Investigation
TASK-100223,Run credit check for Jessica Lopez,Completed,Normal,Margaret Jones,2025-10-13,2025-10-06,2025-10-03,40,"high-value, auto-assigned",Credit Check,Risk Assessment,Underwriting,Run credit check for Jessica Lopez - Actuarial department handling Health insurance in Southwest region,POL-817897,,Jessica Lopez,Health,,2899.63,Lapsed,Southwest,William Chen,Actuarial
TASK-100224,Handle cancellation request from Sandra Jackson,Open,Normal,Nancy Ibrahim,2025-10-27,2025-10-04,2025-10-03,8,VIP-customer,Coverage Changes,Endorsements,Policy Operations,Handle cancellation request from Sandra Jackson - Risk Assessment department handling Life insurance in North region,POL-294969,,Sandra Jackson,Life,,321.42,Cancelled,North,William Chen,Risk Assessment
TASK-100225,Generate quote for Charles Williams,Open,Low,Barbara Ali,2026-05-05,2026-04-28,2026-04-27,3,"payment-due, urgent-claim",Decline Notifications,Declined Applications,Underwriting,Generate quote for Charles Williams - Policy Administration department handling Travel insurance in South region,POL-379449,,Charles Williams,Travel,,3901.18,Pending,South,James Singh,Policy Administration
TASK-100226,Update premium calculation for Sandra Lee,Completed,Normal,Nancy Martin,2025-11-24,2025-11-18,2025-11-16,5,"commercial, high-value, fraud-alert",Application Review,Policy Issuance,Policy Operations,Update premium calculation for Sandra Lee - Risk Assessment department handling Liability insurance in South region,POL-318572,,Sandra Lee,Liability,,824.35,Active,South,Robert Smith,Risk Assessment
TASK-100227,Close resolved claim #CLM-46188,On Hold,Normal,Robert Ibrahim,2025-06-01,2025-05-06,2025-05-03,1,"documentation-pending, manual-review, new-customer",Medical Review,Pending Claims,Claims Management,Close resolved claim #CLM-46188 - Claims Processing department handling Marine insurance in Northeast region,POL-932978,CLM-46188,Sofia Anderson,Marine,61150.79,14538.76,Expired,Northeast,Sofia Anderson,Claims Processing
TASK-100228,Send policy summary to Karen Wilson,Completed,Normal,Mark Jackson,2025-05-07,2025-04-21,2025-04-20,40,"documentation-pending, escalated, legal-review",Claims Inquiries,Inquiries,Customer Support,Send policy summary to Karen Wilson - Claims Processing department handling Travel insurance in North region,POL-775885,,Karen Wilson,Travel,,14728.8,Pending,North,Carlos Anderson,Claims Processing
TASK-100229,Process endorsement for policy #POL-669097,In Progress,Urgent,Elizabeth Jackson,2025-07-27,2025-07-15,2025-07-11,10,"legal-review, payment-due, commercial",Coverage Changes,Endorsements,Policy Operations,Process endorsement for policy #POL-669097 - Risk Assessment department handling Liability insurance in Northwest region,POL-669097,,Nancy Ibrahim,Liability,,7132.24,Cancelled,Northwest,Joseph Moore,Risk Assessment
TASK-100230,Update compliance checklist for Auto,Closed,Normal,Anthony Kim,2026-01-20,2026-01-12,2026-01-08,16,"payment-due, SLA-breach, renewal-due",Confirmed Fraud,Fraud Cases,Compliance & Audit,Update compliance checklist for Auto - New Business department handling Auto insurance in Southwest region,POL-294546,CLM-12453,Michael Ali,Auto,16034.7,1137.46,Expired,Southwest,Lisa Brown,New Business
TASK-100231,Assess risk for Anthony Taylor - Travel,Open,Normal,William Kim,2025-06-11,2025-05-14,2025-05-13,8,high-value,Conditional Approval,Approval Queue,Underwriting,Assess risk for Anthony Taylor - Travel - Underwriting department handling Travel insurance in South region,POL-790897,,Anthony Taylor,Travel,,1784.42,Under Review,South,William Chen,Underwriting
TASK-100232,Review compliance for Travel policies,Blocked,Normal,William Kim,2026-06-03,2026-05-19,2026-05-19,20,"manual-review, SLA-breach, escalated",Suspected Fraud,Fraud Cases,Compliance & Audit,Review compliance for Travel policies - Actuarial department handling Travel insurance in West region,POL-174316,CLM-11715,Aisha Martinez,Travel,40051.0,1098.36,Cancelled,West,Margaret Hernandez,Actuarial
TASK-100233,Escalate disputed claim #CLM-40279 to legal,Closed,Normal,John Ibrahim,2026-02-07,2026-01-31,2026-01-30,24,"VIP-customer, commercial, manual-review",Document Collection,New Claims,Claims Management,Escalate disputed claim #CLM-40279 to legal - Risk Assessment department handling Home insurance in West region,POL-206142,CLM-40279,Jessica Garcia,Home,131784.91,3881.69,Lapsed,West,Carlos Anderson,Risk Assessment
TASK-100234,Escalate issue for John Ibrahim to manager,Completed,Normal,Jessica Kumar,2026-04-30,2026-04-01,2026-03-30,40,"payment-due, escalated",Surveys,Feedback,Customer Support,Escalate issue for John Ibrahim to manager - Risk Assessment department handling Life insurance in East region,POL-629208,,John Ibrahim,Life,,14873.65,Cancelled,East,Lisa Brown,Risk Assessment
TASK-100235,Issue new Commercial policy for Margaret Lopez,In Progress,High,Nancy Ibrahim,2025-10-24,2025-10-23,2025-10-19,0.5,"urgent-claim, fraud-alert",Manual Renewal,Renewals,Policy Operations,Issue new Commercial policy for Margaret Lopez - Compliance department handling Commercial insurance in Northeast region,POL-516379,,Margaret Lopez,Commercial,,14902.5,Under Review,Northeast,Joseph Moore,Compliance
TASK-100236,Conduct process audit for Renewals,On Hold,Urgent,Nancy Ibrahim,2025-09-23,2025-09-14,2025-09-13,10,"regulatory, renewal-due",Process Audit,Internal Audit,Compliance & Audit,Conduct process audit for Renewals - Renewals department handling Auto insurance in Northwest region,POL-245131,CLM-44732,Jessica Ali,Auto,40553.71,1560.2,Expired,Northwest,William Chen,Renewals
TASK-100237,Conduct process audit for Actuarial,On Hold,Low,Ahmed Davis,2026-01-09,2025-12-26,2025-12-23,0.5,manual-review,Annual Reports,Regulatory Filings,Compliance & Audit,Conduct process audit for Actuarial - Actuarial department handling Commercial insurance in North region,POL-182289,CLM-17329,Sofia Jackson,Commercial,46512.3,1984.0,Under Review,North,Joseph Thomas,Actuarial
TASK-100238,Schedule adjuster visit for claim #CLM-75850,Closed,Normal,Aisha Jones,2025-06-28,2025-06-06,2025-06-06,8,"documentation-pending, regulatory",Payment Processing,Settled Claims,Claims Management,Schedule adjuster visit for claim #CLM-75850 - Actuarial department handling Travel insurance in Southwest region,POL-442707,CLM-75850,Thomas Jones,Travel,183028.85,6014.66,Cancelled,Southwest,Joseph Thomas,Actuarial
TASK-100239,Update premium calculation for Omar Miller,In Progress,Normal,Nancy Martin,2025-10-09,2025-09-26,2025-09-26,10,documentation-pending,Manual Renewal,Renewals,Policy Operations,Update premium calculation for Omar Miller - Actuarial department handling Home insurance in Northwest region,POL-151706,,Omar Miller,Home,,11652.61,Pending,Northwest,Susan Singh,Actuarial
TASK-100240,Process renewal for policy #POL-817999,On Hold,Urgent,Robert Martinez,2025-05-15,2025-05-01,2025-04-26,2,"escalated, regulatory",Auto-Renewal,Renewals,Policy Operations,Process renewal for policy #POL-817999 - New Business department handling Home insurance in Central region,POL-817999,,Carlos Singh,Home,,5354.96,Cancelled,Central,Lisa Brown,New Business
TASK-100241,Resolve complaint from Daniel Ibrahim,Blocked,Low,Mark Jackson,2025-05-03,2025-05-01,2025-04-26,5,payment-due,Claims Complaints,Complaints,Customer Support,Resolve complaint from Daniel Ibrahim - Customer Service department handling Auto insurance in West region,POL-491979,,Daniel Ibrahim,Auto,,9390.84,Under Review,West,Michael Kumar,Customer Service
TASK-100242,Conduct property inspection for Sarah Martinez,On Hold,Normal,Daniel Miller,2026-07-10,2026-06-22,2026-06-20,20,manual-review,Appeal Processing,Declined Applications,Underwriting,Conduct property inspection for Sarah Martinez - Customer Service department handling Auto insurance in Northeast region,POL-664139,,Sarah Martinez,Auto,,11002.87,Under Review,Northeast,Margaret Hernandez,Customer Service
TASK-100243,Process claim for Charles Garcia - Auto policy,Blocked,High,Robert Martinez,2026-04-28,2026-04-27,2026-04-22,24,"payment-due, auto-assigned, escalated",Payment Processing,Settled Claims,Claims Management,Process claim for Charles Garcia - Auto policy - Customer Service department handling Auto insurance in Central region,POL-747983,CLM-45557,Charles Garcia,Auto,17116.15,9973.52,Pending,Central,Jennifer Miller,Customer Service
TASK-100244,Send policy summary to John Lee,Completed,Normal,Mark Jackson,2026-05-18,2026-04-18,2026-04-14,5,"fraud-alert, escalated, new-customer",Policy Inquiries,Inquiries,Customer Support,Send policy summary to John Lee - Risk Assessment department handling Liability insurance in Midwest region,POL-295472,,John Lee,Liability,,788.34,Under Review,Midwest,Carlos Anderson,Risk Assessment
TASK-100245,Calculate premium for Commercial policy,On Hold,Normal,Anthony Smith,2025-10-20,2025-10-15,2025-10-14,20,high-value,Pending Approval,Approval Queue,Underwriting,Calculate premium for Commercial policy - Fraud Investigation department handling Commercial insurance in North region,POL-954441,,Joseph Smith,Commercial,,6014.13,Under Review,North,Jennifer Miller,Fraud Investigation
TASK-100246,Send policy summary to Omar Williams,In Progress,High,Barbara Ali,2025-06-06,2025-05-16,2025-05-15,16,payment-due,Billing Complaints,Complaints,Customer Support,Send policy summary to Omar Williams - Fraud Investigation department handling Life insurance in Southeast region,POL-445280,,Omar Williams,Life,,8212.04,Expired,Southeast,Sofia Rodriguez,Fraud Investigation
TASK-100247,Send renewal notice for policy #POL-224138,Completed,Normal,William Kim,2025-06-05,2025-06-04,2025-05-30,24,"SLA-breach, fraud-alert",Manual Renewal,Renewals,Policy Operations,Send renewal notice for policy #POL-224138 - Risk Assessment department handling Home insurance in Southwest region,POL-224138,,Michael Ibrahim,Home,,13225.95,Under Review,Southwest,Joseph Moore,Risk Assessment
TASK-100248,Handle cancellation request from Margaret Nakamura,Blocked,Normal,Anthony Lee,2025-09-06,2025-08-29,2025-08-25,20,manual-review,Auto-Renewal,Renewals,Policy Operations,Handle cancellation request from Margaret Nakamura - Claims Processing department handling Life insurance in East region,POL-741709,,Margaret Nakamura,Life,,586.05,Pending,East,Carlos Anderson,Claims Processing
TASK-100249,Update premium calculation for William Kim,In Progress,Urgent,Ahmed Davis,2025-02-01,2025-01-18,2025-01-16,10,documentation-pending,Non-Payment Cancellation,Cancellations,Policy Operations,Update premium calculation for William Kim - Policy Administration department handling Liability insurance in East region,POL-337264,,William Kim,Liability,,10135.82,Lapsed,East,William Chen,Policy Administration
TASK-100250,Evaluate loss history for policy #POL-871051,Open,Normal,Michael Lopez,2026-03-08,2026-02-12,2026-02-08,10,"legal-review, manual-review, documentation-pending",Decline Notifications,Declined Applications,Underwriting,Evaluate loss history for policy #POL-871051 - Claims Processing department handling Marine insurance in Southeast region,POL-871051,,Jessica Wilson,Marine,,8135.16,Active,Southeast,Jennifer Miller,Claims Processing
TASK-100251,Prepare state filing for Southwest region,Completed,High,Ahmed Davis,2025-07-31,2025-07-16,2025-07-14,0.5,"new-customer, VIP-customer",Training Materials,Documentation,Compliance & Audit,Prepare state filing for Southwest region - New Business department handling Auto insurance in Southwest region,POL-902328,CLM-92660,Jessica Garcia,Auto,19901.99,4707.4,Under Review,Southwest,Margaret Hernandez,New Business
TASK-100252,Process address change for Priya Williams,In Progress,Low,James Brown,2025-06-05,2025-05-22,2025-05-19,4,"regulatory, manual-review",Non-Payment Cancellation,Cancellations,Policy Operations,Process address change for Priya Williams - Underwriting department handling Home insurance in Southwest region,POL-916558,,Priya Williams,Home,,568.7,Cancelled,Southwest,Sofia Anderson,Underwriting
TASK-100253,Escalate disputed claim #CLM-60343 to legal,On Hold,Low,Robert Nakamura,2025-07-04,2025-06-16,2025-06-13,2,"regulatory, payment-due",FNOL Processing,New Claims,Claims Management,Escalate disputed claim #CLM-60343 to legal - Underwriting department handling Liability insurance in Northeast region,POL-841635,CLM-60343,Ahmed Miller,Liability,95461.45,11570.25,Expired,Northeast,Sarah Davis,Underwriting
TASK-100254,Respond to inquiry from Robert Kim,Completed,High,Jessica Santos,2025-10-02,2025-09-17,2025-09-17,24,regulatory,Executive Escalation,Escalations,Customer Support,Respond to inquiry from Robert Kim - Policy Administration department handling Liability insurance in Central region,POL-237962,,Robert Kim,Liability,,7579.91,Pending,Central,James Singh,Policy Administration
