Task_ID,Task_Name,Status,Priority,Assignee,Due_Date,Start_Date,Created_Date,Time_Estimate_Hours,Tags,List_Name,Folder,Space,Description,Policy_Number,Claim_Number,Customer_Name,Insurance_Type,Claim_Amount,Premium_Amount,Policy_Status,Region,Agent_Name,Department
TASK-100383,Update compliance checklist for Commercial,On Hold,Urgent,Nancy Ibrahim,2025-10-09,2025-09-21,2025-09-16,8,"auto-assigned, legal-review",Compliance Check,Internal Audit,Compliance & Audit,Update compliance checklist for Commercial - Claims Processing department handling Commercial insurance in West region,POL-810656,CLM-79853,Jessica Lopez,Commercial,44155.1,228.93,Pending,West,Joseph Moore,Claims Processing
TASK-100384,Verify coverage for claim #CLM-16155,Blocked,Urgent,Lisa Kim,2026-03-26,2026-03-11,2026-03-07,3,"high-value, regulatory",Re-assessment,Disputed Claims,Claims Management,Verify coverage for claim #CLM-16155 - Claims Processing department handling Travel insurance in Southwest region,POL-335455,CLM-16155,Michael Ibrahim,Travel,79402.37,5999.51,Under Review,Southwest,Sofia Rodriguez,Claims Processing
TASK-100385,Review claim #CLM-91958 documentation,In Progress,High,Aisha Jones,2025-02-15,2025-02-01,2025-01-29,5,"legal-review, escalated, fraud-alert",Adjuster Review,Pending Claims,Claims Management,Review claim #CLM-91958 documentation - Fraud Investigation department handling Life insurance in Northeast region,POL-756403,CLM-91958,Michael Wilson,Life,202110.74,8969.46,Active,Northeast,Aisha Miller,Fraud Investigation
TASK-100386,Prepare state filing for South region,Blocked,Normal,Robert Martinez,2025-02-18,2025-02-07,2025-02-04,20,urgent-claim,Process Audit,Internal Audit,Compliance & Audit,Prepare state filing for South region - Compliance department handling Liability insurance in South region,POL-230889,CLM-21211,Patricia Martin,Liability,44504.19,10461.78,Under Review,South,Sofia Rodriguez,Compliance
TASK-100387,Follow up on pending claim #CLM-59998,Completed,Normal,Jessica Kumar,2025-05-08,2025-04-13,2025-04-09,20,"regulatory, urgent-claim, new-customer",Initial Assessment,New Claims,Claims Management,Follow up on pending claim #CLM-59998 - Claims Processing department handling Auto insurance in Southwest region,POL-991215,CLM-59998,Nancy Ibrahim,Auto,103071.45,12995.82,Lapsed,Southwest,Michael Kumar,Claims Processing
TASK-100388,Review bulk quote batch #POL-207677,Closed,High,Jessica Kumar,2025-04-10,2025-03-15,2025-03-11,10,auto-assigned,Credit Check,Risk Assessment,Underwriting,Review bulk quote batch #POL-207677 - Customer Service department handling Travel insurance in Midwest region,POL-207677,,Aisha Davis,Travel,,13584.68,Under Review,Midwest,Lisa Brown,Customer Service
TASK-100389,Process billing inquiry from Sarah Williams,Completed,High,Nancy Ibrahim,2026-07-10,2026-06-15,2026-06-10,4,"documentation-pending, VIP-customer, payment-due",Service Complaints,Complaints,Customer Support,Process billing inquiry from Sarah Williams - Claims Processing department handling Life insurance in North region,POL-426806,,Sarah Williams,Life,,8838.26,Cancelled,North,Linda Smith,Claims Processing
TASK-100390,Review compliance for Health policies,Completed,Normal,Michael Lopez,2025-08-29,2025-07-30,2025-07-25,20,auto-assigned,Process Audit,Internal Audit,Compliance & Audit,Review compliance for Health policies - Risk Assessment department handling Health insurance in Southwest region,POL-542563,CLM-55064,Joseph Singh,Health,10063.06,1212.38,Under Review,Southwest,Aisha Miller,Risk Assessment
TASK-100391,Prepare state filing for Southeast region,Closed,High,Aisha Ibrahim,2026-06-23,2026-05-24,2026-05-23,40,new-customer,Investigation,Fraud Cases,Compliance & Audit,Prepare state filing for Southeast region - Renewals department handling Commercial insurance in Southeast region,POL-209940,CLM-69546,Thomas Ali,Commercial,184.85,3500.77,Cancelled,Southeast,Joseph Thomas,Renewals
TASK-100392,Process address change for Nancy Garcia,In Progress,High,Robert Nakamura,2025-05-09,2025-04-29,2025-04-28,3,"urgent-claim, legal-review",Voluntary Cancellation,Cancellations,Policy Operations,Process address change for Nancy Garcia - Claims Processing department handling Auto insurance in Northeast region,POL-475271,,Nancy Garcia,Auto,,9543.75,Cancelled,Northeast,Sofia Anderson,Claims Processing
TASK-100393,Review application from Wei Lee,Completed,High,Jessica Rodriguez,2026-02-24,2026-01-29,2026-01-24,5,fraud-alert,Standard Quotes,Quote Generation,Underwriting,Review application from Wei Lee - Policy Administration department handling Health insurance in North region,POL-206105,,Wei Lee,Health,,5208.07,Under Review,North,Sofia Anderson,Policy Administration
TASK-100394,Review compliance for Home policies,Closed,Normal,Michael Wilson,2026-02-09,2026-01-28,2026-01-23,16,"renewal-due, urgent-claim, documentation-pending",Training Materials,Documentation,Compliance & Audit,Review compliance for Home policies - Policy Administration department handling Home insurance in South region,POL-933511,CLM-34856,Susan Shah,Home,15897.58,6557.19,Cancelled,South,Carlos Williams,Policy Administration
TASK-100395,Generate quote for Ahmed Moore,Completed,Normal,Robert Nakamura,2026-05-22,2026-05-02,2026-04-27,5,"documentation-pending, commercial, escalated",Standard Quotes,Quote Generation,Underwriting,Generate quote for Ahmed Moore - Risk Assessment department handling Commercial insurance in East region,POL-612743,,Ahmed Moore,Commercial,,7727.48,Under Review,East,Carlos Anderson,Risk Assessment
TASK-100396,Update compliance checklist for Liability,In Progress,High,Robert Santos,2025-02-16,2025-02-08,2025-02-07,8,SLA-breach,Training Materials,Documentation,Compliance & Audit,Update compliance checklist for Liability - Fraud Investigation department handling Liability insurance in Northwest region,POL-520422,CLM-93637,Patricia Martin,Liability,44744.23,6890.79,Lapsed,Northwest,Sofia Anderson,Fraud Investigation
TASK-100397,Conduct property inspection for Michael Brown,Under Review,Low,Nancy Ibrahim,2025-03-04,2025-02-15,2025-02-12,4,"SLA-breach, legal-review",Pending Approval,Approval Queue,Underwriting,Conduct property inspection for Michael Brown - Fraud Investigation department handling Life insurance in South region,POL-644022,,Michael Brown,Life,,6506.31,Pending,South,Linda Smith,Fraud Investigation
TASK-100398,Process address change for Sarah Chen,In Progress,High,Anthony Smith,2025-04-23,2025-03-24,2025-03-22,5,"urgent-claim, commercial",Voluntary Cancellation,Cancellations,Policy Operations,Process address change for Sarah Chen - Renewals department handling Commercial insurance in South region,POL-408824,,Sarah Chen,Commercial,,1955.1,Cancelled,South,Omar Smith,Renewals
TASK-100399,Run credit check for Daniel Lee,On Hold,Normal,Anthony Kim,2026-01-06,2025-12-24,2025-12-21,2,new-customer,Bulk Quotes,Quote Generation,Underwriting,Run credit check for Daniel Lee - Fraud Investigation department handling Life insurance in Southwest region,POL-907483,,Daniel Lee,Life,,11415.53,Pending,Southwest,Jennifer Miller,Fraud Investigation
TASK-100400,Generate policy documents for #POL-894423,Completed,Low,Mark Jackson,2025-12-26,2025-12-15,2025-12-15,5,"SLA-breach, renewal-due, new-customer",Manual Renewal,Renewals,Policy Operations,Generate policy documents for #POL-894423 - Actuarial department handling Health insurance in Southwest region,POL-894423,,Aisha Kumar,Health,,6546.14,Expired,Southwest,Susan Singh,Actuarial
TASK-100401,Update premium calculation for Fatima Santos,In Progress,Low,Nancy Ibrahim,2026-03-13,2026-02-23,2026-02-18,20,"documentation-pending, urgent-claim, VIP-customer",Address Changes,Endorsements,Policy Operations,Update premium calculation for Fatima Santos - Renewals department handling Auto insurance in Northwest region,POL-336444,,Fatima Santos,Auto,,8886.94,Under Review,Northwest,Lisa Brown,Renewals
TASK-100402,Review training materials for Underwriting,Open,Normal,Robert Nakamura,2025-05-13,2025-04-24,2025-04-22,0.5,"high-value, VIP-customer",Compliance Records,Documentation,Compliance & Audit,Review training materials for Underwriting - Underwriting department handling Health insurance in Southeast region,POL-505205,CLM-34685,Patricia Garcia,Health,48096.91,9657.25,Under Review,Southeast,Lisa Brown,Underwriting
TASK-100403,Assist James Lee with claims process,Blocked,Low,Daniel Miller,2026-07-06,2026-06-21,2026-06-21,2,escalated,General Inquiries,Inquiries,Customer Support,Assist James Lee with claims process - New Business department handling Health insurance in South region,POL-315893,,James Lee,Health,,7874.27,Active,South,Carlos Williams,New Business
TASK-100404,File annual report for Southeast,On Hold,Normal,Margaret Jones,2026-05-23,2026-05-03,2026-05-02,3,commercial,Compliance Records,Documentation,Compliance & Audit,File annual report for Southeast - Customer Service department handling Home insurance in Southeast region,POL-315667,CLM-50600,Susan Shah,Home,28754.57,4792.64,Active,Southeast,Carlos Williams,Customer Service
TASK-100405,Schedule callback for Sofia Ali,Blocked,Normal,Robert Martinez,2025-02-18,2025-02-15,2025-02-10,8,"escalated, manual-review",Policy Inquiries,Inquiries,Customer Support,Schedule callback for Sofia Ali - Renewals department handling Health insurance in Southwest region,POL-614807,,Sofia Ali,Health,,13238.71,Lapsed,Southwest,Sofia Anderson,Renewals
TASK-100406,Resolve complaint from Christopher Shah,Closed,High,Ahmed Davis,2026-02-14,2026-02-12,2026-02-07,1,"legal-review, auto-assigned",Service Complaints,Complaints,Customer Support,Resolve complaint from Christopher Shah - New Business department handling Marine insurance in Northwest region,POL-292355,,Christopher Shah,Marine,,13083.99,Under Review,Northwest,Robert Smith,New Business
TASK-100407,Process billing inquiry from Patricia Patel,On Hold,Normal,Lisa Kim,2026-04-17,2026-04-08,2026-04-07,10,high-value,Surveys,Feedback,Customer Support,Process billing inquiry from Patricia Patel - Underwriting department handling Travel insurance in South region,POL-903774,,Patricia Patel,Travel,,860.6,Pending,South,Aisha Miller,Underwriting
TASK-100408,Update Patricia Davis on policy status,Completed,High,William Kim,2026-05-09,2026-04-24,2026-04-21,4,manual-review,Claims Complaints,Complaints,Customer Support,Update Patricia Davis on policy status - Fraud Investigation department handling Auto insurance in North region,POL-843544,,Patricia Davis,Auto,,8316.74,Expired,North,Sofia Anderson,Fraud Investigation
TASK-100409,Review claim #CLM-32079 documentation,Open,Low,Elizabeth Shah,2025-01-26,2025-01-17,2025-01-12,3,manual-review,FNOL Processing,New Claims,Claims Management,Review claim #CLM-32079 documentation - Risk Assessment department handling Commercial insurance in South region,POL-509835,CLM-32079,Sarah Martinez,Commercial,38797.37,5499.69,Pending,South,Sarah Davis,Risk Assessment
TASK-100410,File annual report for Northwest,Open,Low,Nancy Ibrahim,2025-08-08,2025-07-27,2025-07-26,3,SLA-breach,Federal Filings,Regulatory Filings,Compliance & Audit,File annual report for Northwest - Claims Processing department handling Commercial insurance in Northwest region,POL-104892,CLM-16378,Barbara Williams,Commercial,45437.82,3159.79,Under Review,Northwest,Joseph Jones,Claims Processing
TASK-100411,Send renewal notice for policy #POL-637395,In Progress,High,Robert Ibrahim,2025-12-22,2025-12-01,2025-11-27,5,"SLA-breach, legal-review, high-value",Delivery,Policy Issuance,Policy Operations,Send renewal notice for policy #POL-637395 - Claims Processing department handling Life insurance in East region,POL-637395,,Sarah Kumar,Life,,3265.37,Expired,East,Linda Smith,Claims Processing
TASK-100412,Assist Linda Kumar with claims process,Closed,Normal,Ahmed Davis,2026-01-16,2026-01-13,2026-01-13,20,"new-customer, high-value, manual-review",Manager Escalation,Escalations,Customer Support,Assist Linda Kumar with claims process - Compliance department handling Marine insurance in West region,POL-169223,,Linda Kumar,Marine,,6284.23,Expired,West,Joseph Moore,Compliance
TASK-100413,Request additional documents for claim #CLM-51676,On Hold,High,Jessica Santos,2025-03-14,2025-03-13,2025-03-11,40,"commercial, auto-assigned",Closure Documentation,Settled Claims,Claims Management,Request additional documents for claim #CLM-51676 - Policy Administration department handling Life insurance in Northeast region,POL-898717,CLM-51676,Fatima Hernandez,Life,152329.06,8858.55,Active,Northeast,Jennifer Miller,Policy Administration
TASK-100414,Investigate damage report for Sofia Lee,Closed,Low,Michael Lopez,2026-02-01,2026-01-22,2026-01-19,40,"urgent-claim, renewal-due, manual-review",Document Collection,New Claims,Claims Management,Investigate damage report for Sofia Lee - Customer Service department handling Health insurance in Southeast region,POL-183246,CLM-17854,Sofia Lee,Health,50901.94,5761.07,Cancelled,Southeast,Carlos Williams,Customer Service
TASK-100415,Evaluate loss history for policy #POL-988075,On Hold,Normal,Aisha Jones,2025-09-25,2025-09-07,2025-09-06,20,documentation-pending,Pending Approval,Approval Queue,Underwriting,Evaluate loss history for policy #POL-988075 - Claims Processing department handling Marine insurance in Central region,POL-988075,,Sarah Singh,Marine,,13781.64,Pending,Central,Margaret Hernandez,Claims Processing
TASK-100416,Review application from Sarah Thomas,Closed,Urgent,Lisa Kim,2025-08-02,2025-07-30,2025-07-29,10,renewal-due,Custom Quotes,Quote Generation,Underwriting,Review application from Sarah Thomas - Compliance department handling Auto insurance in South region,POL-301814,,Sarah Thomas,Auto,,8322.94,Cancelled,South,Sofia Anderson,Compliance
TASK-100417,Generate policy documents for #POL-399214,In Progress,Normal,Jessica Kumar,2025-08-25,2025-07-28,2025-07-26,16,"SLA-breach, legal-review",Manual Renewal,Renewals,Policy Operations,Generate policy documents for #POL-399214 - Customer Service department handling Life insurance in Midwest region,POL-399214,,Patricia Davis,Life,,1384.24,Lapsed,Midwest,Sofia Rodriguez,Customer Service
TASK-100418,Process address change for Patricia Williams,Completed,Normal,Aisha Ibrahim,2025-07-04,2025-06-10,2025-06-06,1,"new-customer, fraud-alert",Voluntary Cancellation,Cancellations,Policy Operations,Process address change for Patricia Williams - Underwriting department handling Marine insurance in Southeast region,POL-414815,,Patricia Williams,Marine,,5830.66,Cancelled,Southeast,Carlos Williams,Underwriting
TASK-100419,Schedule callback for Aisha Brown,Closed,Urgent,Robert Santos,2026-03-07,2026-02-22,2026-02-19,0.5,"fraud-alert, auto-assigned",Service Complaints,Complaints,Customer Support,Schedule callback for Aisha Brown - Claims Processing department handling Health insurance in North region,POL-865847,,Aisha Brown,Health,,5722.54,Active,North,Joseph Thomas,Claims Processing
TASK-100420,Conduct process audit for Renewals,Open,Low,Robert Ibrahim,2025-03-19,2025-03-06,2025-03-01,24,new-customer,Process Audit,Internal Audit,Compliance & Audit,Conduct process audit for Renewals - Renewals department handling Marine insurance in Central region,POL-843575,CLM-74044,Carlos Nakamura,Marine,46325.94,11087.83,Under Review,Central,Linda Smith,Renewals
TASK-100421,Update beneficiary for Thomas Moore,Closed,Low,James Brown,2025-02-07,2025-01-13,2025-01-13,16,"SLA-breach, manual-review",Address Changes,Endorsements,Policy Operations,Update beneficiary for Thomas Moore - Fraud Investigation department handling Liability insurance in East region,POL-731399,,Thomas Moore,Liability,,10731.82,Expired,East,Sofia Rodriguez,Fraud Investigation
TASK-100422,Handle cancellation request from Christopher Shah,Under Review,Normal,Ahmed Davis,2026-03-31,2026-03-03,2026-02-26,40,"payment-due, VIP-customer",Non-Payment Cancellation,Cancellations,Policy Operations,Handle cancellation request from Christopher Shah - Risk Assessment department handling Commercial insurance in Southwest region,POL-501382,,Christopher Shah,Commercial,,9615.47,Pending,Southwest,Omar Smith,Risk Assessment
TASK-100423,Escalate disputed claim #CLM-64767 to legal,In Progress,High,Robert Nakamura,2026-03-18,2026-03-08,2026-03-03,16,"VIP-customer, manual-review",Third-Party Verification,Pending Claims,Claims Management,Escalate disputed claim #CLM-64767 to legal - Underwriting department handling Auto insurance in South region,POL-830140,CLM-64767,David Patel,Auto,183394.04,2725.39,Active,South,James Singh,Underwriting
TASK-100424,File annual report for North,Under Review,Urgent,John Ibrahim,2026-05-02,2026-04-02,2026-03-28,4,high-value,Process Audit,Internal Audit,Compliance & Audit,File annual report for North - Policy Administration department handling Health insurance in North region,POL-301205,CLM-43993,Patricia Williams,Health,31221.07,13051.76,Active,North,Aisha Miller,Policy Administration
TASK-100425,Close resolved claim #CLM-10947,Completed,Normal,Nancy Ibrahim,2025-02-19,2025-02-12,2025-02-12,20,"commercial, documentation-pending, fraud-alert",Third-Party Verification,Pending Claims,Claims Management,Close resolved claim #CLM-10947 - Claims Processing department handling Liability insurance in South region,POL-379005,CLM-10947,Joseph Santos,Liability,130822.47,307.48,Pending,South,Aisha Miller,Claims Processing
TASK-100426,Evaluate loss history for policy #POL-740479,Closed,High,Anthony Lee,2025-12-06,2025-12-05,2025-12-05,4,"payment-due, VIP-customer, urgent-claim",Conditional Approval,Approval Queue,Underwriting,Evaluate loss history for policy #POL-740479 - New Business department handling Health insurance in Northeast region,POL-740479,,Lisa Smith,Health,,10534.96,Under Review,Northeast,Jennifer Miller,New Business
TASK-100427,Assess risk for Thomas Miller - Marine,Completed,Normal,William Kim,2026-01-30,2026-01-04,2026-01-04,1,regulatory,Appeal Processing,Declined Applications,Underwriting,Assess risk for Thomas Miller - Marine - Claims Processing department handling Marine insurance in West region,POL-952092,,Thomas Miller,Marine,,10233.36,Cancelled,West,Sofia Rodriguez,Claims Processing
TASK-100428,Send policy summary to William Kim,In Progress,Low,John Ibrahim,2026-06-06,2026-06-01,2026-06-01,10,"commercial, payment-due, new-customer",Claims Inquiries,Inquiries,Customer Support,Send policy summary to William Kim - Actuarial department handling Marine insurance in Central region,POL-846525,,William Kim,Marine,,1488.93,Under Review,Central,Sarah Jones,Actuarial
TASK-100429,Update beneficiary for Ahmed Kim,On Hold,High,Elizabeth Shah,2025-12-29,2025-12-04,2025-12-01,24,"new-customer, auto-assigned, high-value",Auto-Renewal,Renewals,Policy Operations,Update beneficiary for Ahmed Kim - Underwriting department handling Life insurance in South region,POL-850534,,Ahmed Kim,Life,,10843.79,Under Review,South,William Chen,Underwriting
TASK-100430,Escalate disputed claim #CLM-60023 to legal,Under Review,Normal,Ahmed Davis,2026-04-02,2026-03-25,2026-03-24,3,high-value,Payment Processing,Settled Claims,Claims Management,Escalate disputed claim #CLM-60023 to legal - New Business department handling Home insurance in Northeast region,POL-879058,CLM-60023,Aisha Martinez,Home,65143.94,4506.45,Under Review,Northeast,Michael Kumar,New Business
TASK-100431,Prepare state filing for Southeast region,Closed,Normal,Jessica Santos,2025-07-31,2025-07-17,2025-07-14,3,"legal-review, documentation-pending, VIP-customer",Suspected Fraud,Fraud Cases,Compliance & Audit,Prepare state filing for Southeast region - Actuarial department handling Travel insurance in Southeast region,POL-101760,CLM-50737,Aisha Jones,Travel,15982.15,5602.35,Active,Southeast,Joseph Thomas,Actuarial
TASK-100432,Investigate damage report for John Thomas,Under Review,Normal,Barbara Ali,2025-11-12,2025-10-19,2025-10-18,1,"urgent-claim, regulatory, escalated",Re-assessment,Disputed Claims,Claims Management,Investigate damage report for John Thomas - Customer Service department handling Life insurance in Central region,POL-813011,CLM-69740,John Thomas,Life,166505.0,12059.12,Cancelled,Central,Susan Singh,Customer Service
TASK-100433,Follow up on feedback from William Rodriguez,Open,Normal,Nancy Ibrahim,2025-03-24,2025-02-24,2025-02-23,8,"legal-review, payment-due, VIP-customer",Claims Complaints,Complaints,Customer Support,Follow up on feedback from William Rodriguez - Claims Processing department handling Commercial insurance in Southeast region,POL-260119,,William Rodriguez,Commercial,,5998.76,Under Review,Southeast,William Chen,Claims Processing
TASK-100434,Calculate premium for Home policy,On Hold,High,Barbara Ibrahim,2026-02-13,2026-02-08,2026-02-08,2,payment-due,Appeal Processing,Declined Applications,Underwriting,Calculate premium for Home policy - Fraud Investigation department handling Home insurance in Southwest region,POL-830203,,James Lee,Home,,11910.91,Lapsed,Southwest,Carlos Williams,Fraud Investigation
TASK-100435,Respond to inquiry from Lisa Miller,Completed,Normal,Robert Nakamura,2026-02-08,2026-01-11,2026-01-06,0.5,SLA-breach,Reviews,Feedback,Customer Support,Respond to inquiry from Lisa Miller - Customer Service department handling Life insurance in West region,POL-305159,,Lisa Miller,Life,,10239.1,Active,West,Carlos Anderson,Customer Service
TASK-100436,Process billing inquiry from Patricia Moore,On Hold,Normal,Barbara Ali,2025-09-12,2025-09-08,2025-09-08,24,"regulatory, VIP-customer, auto-assigned",Service Complaints,Complaints,Customer Support,Process billing inquiry from Patricia Moore - Renewals department handling Home insurance in Southwest region,POL-554894,,Patricia Moore,Home,,7431.66,Under Review,Southwest,Joseph Jones,Renewals
TASK-100437,Resolve complaint from Robert Kim,Under Review,Normal,John Ibrahim,2026-06-12,2026-05-21,2026-05-16,20,"regulatory, legal-review, new-customer",Reviews,Feedback,Customer Support,Resolve complaint from Robert Kim - Claims Processing department handling Liability insurance in Northeast region,POL-222292,,Robert Kim,Liability,,3529.04,Expired,Northeast,Joseph Thomas,Claims Processing
TASK-100438,Escalate issue for Michael Wilson to manager,Blocked,Normal,Barbara Ali,2026-02-26,2026-02-25,2026-02-20,24,"new-customer, high-value, commercial",Reviews,Feedback,Customer Support,Escalate issue for Michael Wilson to manager - Renewals department handling Life insurance in South region,POL-848440,,Michael Wilson,Life,,12298.45,Active,South,Robert Smith,Renewals
TASK-100439,Review claim #CLM-51195 documentation,Open,Urgent,John Ibrahim,2025-03-02,2025-02-11,2025-02-10,16,"fraud-alert, payment-due, documentation-pending",Medical Review,Pending Claims,Claims Management,Review claim #CLM-51195 documentation - Risk Assessment department handling Life insurance in North region,POL-939398,CLM-51195,Margaret Lopez,Life,51954.36,2585.91,Cancelled,North,Carlos Anderson,Risk Assessment
TASK-100440,Verify fraud indicators for claim #CLM-48456,Closed,High,John Ibrahim,2026-04-21,2026-04-02,2026-04-01,24,"regulatory, commercial",Financial Audit,Internal Audit,Compliance & Audit,Verify fraud indicators for claim #CLM-48456 - Fraud Investigation department handling Auto insurance in West region,POL-644675,CLM-48456,Richard Chen,Auto,24522.14,4831.45,Active,West,Jennifer Miller,Fraud Investigation
TASK-100441,Close resolved claim #CLM-38316,On Hold,Low,Daniel Miller,2026-01-10,2026-01-05,2026-01-03,10,"fraud-alert, legal-review, SLA-breach",Adjuster Review,Pending Claims,Claims Management,Close resolved claim #CLM-38316 - Policy Administration department handling Commercial insurance in West region,POL-678888,CLM-38316,Omar Williams,Commercial,182411.55,6445.82,Active,West,Joseph Moore,Policy Administration
TASK-100442,Follow up on feedback from Fatima Hernandez,Blocked,High,Jessica Rodriguez,2026-02-12,2026-01-21,2026-01-17,8,SLA-breach,Billing Complaints,Complaints,Customer Support,Follow up on feedback from Fatima Hernandez - Fraud Investigation department handling Health insurance in South region,POL-830650,,Fatima Hernandez,Health,,7769.13,Pending,South,Linda Smith,Fraud Investigation
TASK-100443,File annual report for South,Blocked,High,Mark Jackson,2025-04-01,2025-03-11,2025-03-09,1,"VIP-customer, payment-due",Process Audit,Internal Audit,Compliance & Audit,File annual report for South - Risk Assessment department handling Commercial insurance in South region,POL-817204,CLM-81875,Christopher Nakamura,Commercial,4448.71,13656.83,Pending,South,Jennifer Miller,Risk Assessment
TASK-100444,Resolve complaint from Fatima Garcia,Under Review,Low,Daniel Miller,2026-01-17,2025-12-29,2025-12-24,2,"high-value, urgent-claim, VIP-customer",General Inquiries,Inquiries,Customer Support,Resolve complaint from Fatima Garcia - Fraud Investigation department handling Life insurance in Southwest region,POL-961240,,Fatima Garcia,Life,,8362.83,Cancelled,Southwest,Sarah Jones,Fraud Investigation
TASK-100445,Investigate suspected fraud case #CLM-30380,Blocked,High,William Kim,2025-06-18,2025-05-30,2025-05-27,8,"auto-assigned, escalated, manual-review",Compliance Records,Documentation,Compliance & Audit,Investigate suspected fraud case #CLM-30380 - Claims Processing department handling Life insurance in Central region,POL-638512,CLM-30380,Daniel Ibrahim,Life,36771.12,982.4,Under Review,Central,James Singh,Claims Processing
TASK-100446,Process endorsement for policy #POL-548544,On Hold,Urgent,Lisa Kim,2025-12-12,2025-11-14,2025-11-09,3,"payment-due, high-value",Non-Payment Cancellation,Cancellations,Policy Operations,Process endorsement for policy #POL-548544 - Fraud Investigation department handling Liability insurance in Southwest region,POL-548544,,William Jackson,Liability,,4723.79,Active,Southwest,Sofia Anderson,Fraud Investigation
